{
  "meta": {
    "schema_version": "1.0.0",
    "document_type": "country_food_law_and_food_safety_profile",
    "country": "Kingdom of Bahrain",
    "country_arabic": "مملكة البحرين",
    "iso_3166_1_alpha_2": "BH",
    "iso_3166_1_alpha_3": "BHR",
    "region": "Gulf Cooperation Council (GCC)",
    "compiled_on": "2026-07-28",
    "data_current_as_of": "2026-07-28",
    "language_of_record": "en",
    "source_document_supplied_by_user": {
      "filename": "638242460024477544_BAHRAIN.pdf",
      "description": "Ministry of Health, Public Health Directorate, Food Control Section - 'Food Safety Guidelines' (Food Safety Guideline in Food Premises), Document No. FCS/3, Version 4, 11 sections.",
      "document_date": "undated in document; Version 4",
      "status": "used as base; all substantive content re-verified against current official and secondary sources"
    },
    "verification": {
      "method": "Text extracted from the supplied PDF, then each legal instrument, authority name and requirement cross-checked against official gazettes/legal portals, the competent authority website, FAOLEX/ECOLEX, and current regulatory-intelligence reporting.",
      "overall_confidence": "medium-high",
      "caveats": [
        "The supplied PDF is a guideline for food premises, not a statute. The statutory basis was added from official sources: the operative general framework is Public Health Law No. 34 of 2018.",
        "Bahrain has NO single consolidated food safety act. Food control rests on the Public Health Law No. 34 of 2018, older instruments such as Legislative Decree No. 3 of 1985 on the control of imported foodstuffs, product-specific decrees and ministerial resolutions, and adopted GSO standards.",
        "There is NO 'Bahrain National Food Safety Authority'. Search results returning that name refer to other countries' bodies. The competent authority is the Food Control Section of the Public Health Directorate, Ministry of Health.",
        "The status of Legislative Decree No. 3 of 1985 relative to Public Health Law No. 34 of 2018 was not fully verified - the 2018 law may have superseded parts of it. Flagged for legal verification.",
        "Version 4 of the guideline is undated; the companion Food Importers Guide has a 2024 edition which is the better current reference for import rules."
      ]
    }
  },
  "competent_authorities": {
    "primary": {
      "name": "Ministry of Health - Public Health Directorate - Food Control Section",
      "abbreviation": "MOH PHD FCS",
      "arabic_name": "وزارة الصحة - إدارة الصحة العامة - قسم مراقبة الأغذية",
      "role": "Implements health policy in all matters of food safety under Public Health Law No. 34 of 2018. Licenses and inspects food establishments, approves premises sketches and plans, approves new production lines and equipment, controls imported food at ports of entry through the Imported Food Safety Group, applies risk-based inspection, and handles rejected shipments (re-export or destruction).",
      "website": "https://www.moh.gov.bh",
      "sub_units": [
        {
          "name": "Imported Food Safety Group / Imported Food Unit",
          "role": "Inspects all food arriving through the three ports of entry (seaport, air cargo, King Fahd Causeway) applying risk-based systems and global best practice. Public health specialists are stationed at each port."
        },
        {
          "name": "Licensing Department (Public Health Directorate)",
          "role": "Issues the certificate to practise commercial activities under health surveillance."
        }
      ],
      "document_reference": "Guideline document No. FCS/3, Version 4"
    },
    "supporting_authorities": [
      {
        "name": "Ministry of Industry and Commerce",
        "abbreviation": "MOIC",
        "role": "Commercial registration (Sijilat), consumer protection, and - via the Standards and Metrology Directorate - national standards, adoption of GSO standards and the standards store.",
        "website": "https://www.moic.gov.bh",
        "standards_store": "https://bsmd.moic.gov.bh"
      },
      {
        "name": "Standards and Metrology Directorate (BSMD), MOIC",
        "role": "Develops and adopts national standards including food safety and quality standards; technical evaluation of products; issues resolutions adopting Gulf technical regulations."
      },
      {
        "name": "Ministry of Municipalities Affairs and Agriculture",
        "abbreviation": "MMAA",
        "role": "Municipal licensing and inspection of food premises; agriculture, veterinary and marine resources; co-formulates food import regulations.",
        "note": "Also referenced in official material as the National Agri-trade and Food Safety Authority function area - verify the current organisational naming."
      },
      {
        "name": "Customs Affairs (Ministry of Interior)",
        "role": "Border control; verifies that food imports comply with health and safety requirements before entry; HS-code classification and tariffs.",
        "website": "https://www.bahraincustoms.gov.bh"
      },
      {
        "name": "Municipalities",
        "role": "Licensing and inspection of food service outlets, sanitary conditions and waste management."
      }
    ],
    "governance_model": "Multi-agency. MOH Public Health Directorate (Food Control Section) is the enforcement authority for food safety; import regulations are formulated jointly by MOH PHD, the MOIC Standards and Metrology Directorate and MMAA."
  },
  "legal_framework": {
    "primary_law": {
      "citation": "Public Health Law No. 34 of 2018",
      "arabic_citation": "قانون الصحة العامة رقم 34 لسنة 2018",
      "status": "In force",
      "role": "The operative legal basis for food control in Bahrain. Covers all public health services for individuals, precautionary measures to maintain infrastructure, water monitoring, waste management, and precautionary measures for communicable and non-communicable diseases. The Food Control Section acts under this law.",
      "food_specific_powers": [
        "Licensing of food activities - operating without a licence is a violation subject to penalties under the Public Health Law",
        "Prohibition of unauthorised food activities",
        "Basis for the decision to re-export or destroy rejected food shipments"
      ],
      "note": "Bahrain does not have a dedicated consolidated food safety act. Food safety obligations are distributed across this law, product-specific decrees and ministerial resolutions, and adopted GSO standards."
    },
    "other_legislation": [
      {
        "citation": "Legislative Decree No. 3 of 1985 on the control of imported foodstuffs",
        "status": "Historically the principal imported-food instrument",
        "verification_flag": "Verify whether it remains in force in whole or part following Public Health Law No. 34 of 2018."
      },
      {
        "citation": "Decree Law No. 4 of 1995 on the control of the use, marketing and promotion of breast milk substitutes",
        "relevance": "Infant formula and breast milk substitute marketing controls."
      },
      {
        "citation": "Ministerial Resolution No. 1 of 2014 (MOIC) adopting the Gulf Regulations for Children's Toys",
        "relevance": "Food items accompanied by children's toys must bear the Gulf Conformity mark."
      },
      {
        "citation": "Ministerial Resolution No. 89 of 2022 on the import and trading of gelatin candy for children",
        "content": "Prohibits the import and trading of gelatin candy for children containing konjac (E425) or any of its alternative names (Klakumanan, Konyako, Konjonak, tarot powder, yam flour, or any other name).",
        "status": "In force"
      },
      {
        "citation": "Resolution No. 115 of 2024 regulating the import, trade and use of veterinary preparations in the poultry and food-producing animals sector",
        "relevance": "Veterinary drug controls upstream of food safety.",
        "status": "In force"
      }
    ],
    "key_guidance_documents": [
      {
        "citation": "Food Safety Guidelines - Food Safety Guideline in Food Premises, Doc. No. FCS/3, Version 4 (the supplied PDF)",
        "issuer": "MOH Public Health Directorate, Food Control Section",
        "structure": [
          {
            "section": 1,
            "title": "Objectives"
          },
          {
            "section": 2,
            "title": "Scope"
          },
          {
            "section": 3,
            "title": "Definitions"
          },
          {
            "section": 4,
            "title": "Registration and Licensing"
          },
          {
            "section": 5,
            "title": "Establishment's Design and Facilities"
          },
          {
            "section": 6,
            "title": "Operating Control"
          },
          {
            "section": 7,
            "title": "Facilities: Maintenance and Health Conditions"
          },
          {
            "section": 8,
            "title": "Facilities: Personal Hygiene"
          },
          {
            "section": 9,
            "title": "Transport"
          },
          {
            "section": 10,
            "title": "Product Information and Consumer Awareness"
          },
          {
            "section": 11,
            "title": "Training"
          }
        ]
      },
      {
        "citation": "Food Importers Guide to the Kingdom of Bahrain (2024 edition)",
        "issuer": "MOH Public Health Directorate, Food Control Section",
        "url": "https://www.ofoq.gov.bh/pdf/FoodImportersGuide_2024_EN.pdf",
        "structure": [
          "Phase 1 Pre-import: classification, licensing, awareness, general specification requirements",
          "Phase 2 After import: required documents, inspection procedures, non-commercial/personal-use imports, handling of rejected shipments, health certificate forms"
        ]
      },
      {